Product Name,PLU,UOM,Step,Rating,Rates Count,Price,Property Clarification,Weight,Nutrients Protein,Nutrients Fat,Nutrients Carbs,Nutrients Calories,Score
Печенье Дымка Домашние Вафельки сдобные с малиновой начинкой,4323778,кг,0.3,4.89,4289,,Цена за 1 кг,300.0,5.1,10.0,65.1,371.0,5.67
Печенье Ulker сэндвич с маршмеллоу и кокосом в глазури 66г,4316119,шт,1.0,4.89,2961,,66 г,66.0,5.4,19.0,71.0,483.0,5.33
Печенье Дымка Юбилейная Песенка сахарное шоколадное,4370100,кг,0.4,4.86,5032,399.99,Цена за 1 кг,400.0,7.8,17.8,61.7,438.0,5.33
Батончик Спартак Milx вафельный 35г,4351980,шт,1.0,4.91,4171,42.99,35 г,35.0,5.0,33.0,59.0,550.0,3.33
Печенье Сладкая слобода Сдобное топленое молоко,4327890,кг,0.3,4.87,3750,369.99,Цена за 1 кг,300.0,6.7,15.1,67.2,432.0,5.0
Печенье Сладкая слобода Деревенское Нежное сахарное,4367771,кг,0.35,4.87,1255,399.99,Цена за 1 кг,350.0,7.7,19.5,65.3,468.0,7.0
Пирожное бисквитное Медвежонок Барни с бананово-йогуртовой начинкой 150г,3358963,шт,1.0,4.94,13064,103.99,150 г,150.0,6.0,15.0,54.0,376.0,5.0
Пирожное Mirel Муравейник 340г,4290678,шт,1.0,4.91,5727,295.99,340 г,340.0,6.0,16.3,58.9,406.0,4.67
Торт Mirel карамельный на сгущенке 700г,4155324,шт,1.0,4.91,6379,519.99,700 г,700.0,4.0,14.0,44.0,320.0,4.67
Эклеры Фили-Бейкер заварные 250г,3276844,шт,1.0,4.91,5798,273.99,250 г,250.0,4.9,15.7,31.4,284.0,6.33
Торт бисквитный Baker House Трюфель 350г,3466436,шт,1.0,4.91,4918,,350 г,350.0,3.5,9.0,61.0,340.0,3.33
Пирожные Фили-Бейкер Кольца заварные 300г,3276842,шт,1.0,4.88,4671,279.99,300 г,300.0,6.2,13.6,34.3,290.0,6.67
Пирожные Baker House мини-тарты карамельно-арахисовые 240г,3639225,шт,1.0,4.89,4140,252.99,240 г,240.0,5.5,24.0,63.0,480.0,3.0
Бисквитное пирожное Kinder Delice 39г,3647915,шт,1.0,4.94,5561,89.99,39 г,39.0,5.5,22.6,58.8,455.0,6.0
Пирожное Ама Эклер Со Сливочным Кремом 168г,4279043,шт,1.0,4.84,4960,153.99,168 г,168.0,3.5,25.0,39.0,390.0,3.33
Торт Фили-Бейкер Панчо бисквитно-фруктовый 1 кг,75638,шт,1.0,4.88,3607,,1 кг,1000.0,4.2,14.4,26.3,252.0,6.67
Торт Mirel Черничное молоко 750г,4132503,шт,1.0,4.9,4075,,750 г,750.0,3.9,14.0,28.8,257.0,4.67
Пирожное Mirel Эклер с белковым кремом 5х32г,4360509,шт,1.0,4.9,4095,214.99,160 г,160.0,5.3,19.5,36.1,341.0,5.33
Торт Фили-Бейкер Пломбир-классик бисквитный 720г,3602480,шт,1.0,4.91,4133,589.99,720 г,720.0,4.9,10.9,49.6,313.0,5.33
Пирожные Фили-Бейкер Корзиночки песочные 300г,4155135,шт,1.0,4.89,3576,384.99,300 г,300.0,2.46,16.4,51.0,360.0,6.67
Торт Mirel Шоколадный тоффи 580г,4353817,шт,1.0,4.87,4000,629.99,580 г,580.0,4.5,19.0,41.0,360.0,2.0
Торт Ама Сказочка 450г,4279047,шт,1.0,4.82,4011,359.99,450 г,450.0,5.0,20.0,43.0,374.0,3.0
Пирожное Mirel профитроли с пломбирным кремом 180г,3481382,шт,1.0,4.87,3959,209.99,180 г,180.0,6.0,19.0,32.0,320.0,5.33
Пирожные Фили-Бейкер Картошка бисквитные 240г,4285392,шт,1.0,4.78,2103,164.99,240 г,240.0,5.8,9.0,54.6,329.0,6.67
Торт Mirel Малиновый Сметанник 650г,4325059,шт,1.0,4.91,3209,679.99,650 г,650.0,3.5,22.0,25.0,310.0,4.0
Торт Черемушки Чародейка бисквитный 650г,37212,шт,1.0,4.88,2740,,650 г,650.0,4.0,18.0,55.0,400.0,3.0
Пирог Тирольские Пироги Ягодный микс 630г,3944531,шт,1.0,4.89,1684,699.99,630 г,630.0,3.4,7.0,27.4,186.0,5.0
Торт Mirel Тирамису 750г,4174636,шт,1.0,4.88,3502,599.99,750 г,750.0,3.5,11.0,31.0,240.0,6.33
Торт Mirel Прага 660г,4188555,шт,1.0,4.88,2862,639.99,660 г,660.0,4.8,24.4,44.3,416.0,4.67
Десерт Фили-Бейкер Панчо бисквитный 150г,4317781,шт,1.0,4.84,2853,239.99,150 г,150.0,3.6,11.8,29.8,241.0,6.33
Торт Mirel Сливочная карамель 650г,4359387,шт,1.0,4.89,2855,,650 г,650.0,3.7,11.5,41.3,284.0,4.0
Торт Rock'n'Cream Медово-Сметанный 400г,4353423,шт,1.0,4.72,845,449.99,400 г,400.0,4.1,19.7,33.7,329.0,6.33
Торт Суфле 300г,4309849,шт,1.0,4.85,1938,262.99,300 г,300.0,2.0,16.0,46.0,336.0,3.67
Пирожное Фили-Бейкер Трубочки слоеные с кремом 100г,3604698,шт,1.0,4.86,476,,100 г,100.0,4.8,20.8,40.3,366.0,5.0
Торт Фили-Бейкер Эскимо Московский бисквитный 450г,4316302,шт,1.0,4.87,1615,589.99,450 г,450.0,5.44,19.1,40.2,361.0,6.33
Торт Черемушки Прага бисквитный 720г,3949026,шт,1.0,4.8,1002,,720 г,720.0,5.0,25.0,45.0,420.0,3.67
Пирожное Cuisine Royale Медовое 120г,4187832,шт,1.0,4.89,1850,142.99,120 г,120.0,6.0,16.0,52.0,376.0,4.33
Пирожное АМА Красный Бархат 200г,4272383,шт,1.0,4.77,1419,252.99,200 г,200.0,4.3,29.5,31.3,410.0,3.0
Торт Фили-Бейкер Наполеон слоеный 660г,4285394,шт,1.0,4.85,2199,,660 г,660.0,3.8,37.2,33.5,384.0,4.0
Пирожное Медвежонок Барни Шоколад бисквитное 30г,3214122,шт,1.0,4.93,5217,32.99,30 г,30.0,5.0,15.0,55.0,379.0,6.0
Торт Фили-Бейкер Панчитто бисквитный 450г,4363603,шт,1.0,4.88,172,599.99,450 г,450.0,4.8,10.4,40.2,274.0,7.0
Пирожное Фили-Бейкер Наполеон домашний 300г,3460123,шт,1.0,4.76,498,,300 г,300.0,3.7,14.6,25.6,387.0,3.0
Пирожные Royal Baker Корзиночки Вишня в шоколаде песочные 250г,4349930,шт,1.0,4.73,1583,239.99,250 г,250.0,4.0,13.0,69.0,407.0,4.67
Торт Mirel Три Шоколада 750г,4293822,шт,1.0,4.8,105,899.99,750 г,750.0,4.5,21.0,40.0,370.0,3.0
Десерт Konti Bonjour вкус рождественский кекс 232г,4313638,шт,1.0,4.77,13,,232 г,232.0,3.0,18.0,65.0,440.0,6.33
Мороженое Лакомство Колибри вафельный рожок 12% СЗМЖ 100г,3307803,шт,1.0,4.92,7558,50.99,100 г,100.0,4.0,14.0,35.0,290.0,7.0
Пломбир Коровка из Кореновки шоколадный стаканчик 15% БЗМЖ 100г,3409340,шт,1.0,4.93,10444,106.99,100 г,100.0,2.5,14.0,21.0,222.0,7.0
Пломбир Филевская Лакомка в шоколадной глазури 15% БЗМЖ 90г,66259,шт,1.0,4.93,6970,88.99,90 г,90.0,3.0,25.6,20.0,320.0,7.67
Пломбир Золотой Стандарт С Таежной Черникой с черничным наполнителем в вафельном стаканчике 12% БЗМЖ 93г,4288713,шт,1.0,4.92,6941,89.99,93 г,93.0,3.6,12.6,32.7,262.0,6.67
Пломбир Коровка из Кореновки крем-брюле стаканчик 15% БЗМЖ 100г,3409339,шт,1.0,4.92,9656,106.99,100 г,100.0,3.0,14.0,19.0,216.0,6.67
Пломбир Золотой Стандарт сэндвич 12% БЗМЖ 69г,3671206,шт,1.0,4.94,8455,99.99,69 г,69.0,5.3,12.5,44.2,311.0,6.67
Пломбир Сарафаново Шоколадный 12% БЗМЖ 70г,4329240,шт,1.0,4.91,7907,76.99,70 г,70.0,4.5,12.0,26.0,230.0,7.0
Пломбир Станция Молочная в вафельном стаканчике 12% БЗМЖ 90г,4214927,шт,1.0,4.9,7203,59.99,90 г,90.0,3.5,12.0,23.0,210.0,7.0
Эскимо Магнат Шоколадный трюфель сливочное с наполнителем-бисквитами в шоколаде 8% БЗМЖ 72г,3926883,шт,1.0,4.94,7296,179.99,72 г,72.0,4.1,18.7,33.4,323.0,4.67
Пломбир Сарафаново Ванильный 12% БЗМЖ 70г,4329337,шт,1.0,4.9,7483,76.99,70 г,70.0,4.5,12.0,26.0,230.0,8.0
Мороженое Maxiduo Соленая Карамель 6% БЗМЖ 94г,4343388,шт,1.0,4.83,1507,98.99,94 г,94.0,3.3,13.8,42.0,305.0,6.33
Мороженое Вологодский Пломбир ванильное 15% БЗМЖ 250г,3603592,шт,1.0,4.92,4721,,250 г,250.0,3.0,15.0,19.7,225.0,6.0
Десерт в вафельном стаканчике с добавлением молока и ароматом ванили замороженный 4% БЗМЖ 60г,4310452,шт,1.0,4.85,5567,13.99,60 г,60.0,3.5,4.0,26.0,150.0,6.67
Эскимо Чистая Линия Малиновый кактус пломбир ванильное с кусочками малины в глазури 12% БЗМЖ 80г,4085329,шт,1.0,4.9,5107,219.99,80 г,80.0,19.6,3.1,28.8,304.0,6.67
Эскимо Фрумелье Лесная ягода сливочное с ароматом ванили в шоколадной глазури 8% БЗМЖ 65г,4376290,шт,1.0,4.86,2324,49.99,65 г,65.0,2.7,16.5,30.3,281.0,6.67
Пломбир Коровка из Кореновки с шоколадной стружкой 15% БЗМЖ 400г,3409352,шт,1.0,4.92,5138,424.99,400 г,400.0,3.5,17.0,20.0,243.0,6.67
Пломбир Золотой стандарт с суфле и шоколадным наполнителем 12% БЗМЖ 475г,3496575,шт,1.0,4.9,2808,495.99,475 г,475.0,3.7,11.4,28.4,230.0,6.0
Мороженое пломбир Сарафаново ванильный на сливках рожок 15% БЗМЖ 110г,4053680,шт,1.0,4.9,5428,142.99,110 г,110.0,4.5,16.0,35.0,300.0,8.0
Мороженое Сарафаново сливочное с ароматом ванили с наполнителем малина-гранат 8% БЗМЖ 180г,4375770,шт,1.0,4.87,1633,199.99,180 г,180.0,2.5,7.5,24.0,170.0,6.0
Эскимо Чистая Линия Российское пломбир 12% БЗМЖ 80г,2128085,шт,1.0,4.92,5550,193.99,80 г,80.0,3.0,22.0,23.0,300.0,8.0
Пломбир Филевское Пралине с грецким орехом и мягкой карамелью 12% БЗМЖ 550г,3956289,шт,1.0,4.92,3785,698.99,550 г,550.0,3.5,15.0,26.0,250.0,6.33
Щербет черносмородиновый 70г,4352747,шт,1.0,4.84,2442,59.99,70 г,70.0,0.0,0.0,28.0,112.0,4.0
"Мороженое Bombbar Ореховый Бум протеиновое с фундучной пастой, арахисом и шоколадной крошкой 6% БЗМЖ 150г",4369312,шт,1.0,4.84,974,,150 г,150.0,15.0,6.0,14.0,179.0,7.67
Пломбир Cuisine Royale ванильный с прослойками шоколадной глазури 12% БЗМЖ 450г,4215524,шт,1.0,4.82,4079,,450 г,450.0,3.5,17.0,21.0,250.0,6.0
Мороженое Вологодский Пломбир с кусочками брусники и клюквы в вафельном стаканчике 12% БЗМЖ 100г,4051288,шт,1.0,4.86,2405,,100 г,100.0,2.5,10.5,30.0,220.0,7.0
Мороженое Коровка из Кореновки пломбир с малиной в вафельном стаканчике 15% БЗМЖ 100г,4286842,шт,1.0,4.89,4977,,100 г,100.0,3.0,10.0,31.0,226.0,8.0
Эскимо Свитлогорье пломбир ванильное в глазури 15% БЗМЖ 80г,3628052,шт,1.0,4.9,3202,129.99,80 г,80.0,3.1,23.9,20.1,310.0,6.33
Эскимо Сарафаново пломбир ванильный в глазури 12% БЗМЖ 75г,4124694,шт,1.0,4.9,5524,126.99,75 мл,75.0,3.5,23.0,23.0,310.0,7.67
Мороженое Верховье эскимо сливочное с ароматом ванили с лимонным наполнителем в лимонной глазури 8% 70г,4281704,шт,1.0,4.91,3995,,70 г,70.0,2.5,15.0,27.0,250.0,6.33
Пломбир Чистая Линия Радуга рожок 12% БЗМЖ 110г,3955964,шт,1.0,4.88,5002,196.99,110 г,110.0,4.1,10.4,34.1,246.0,7.0
Мороженое Коровка Из Кореновки двухслойное пломбир шоколадный с вишней 15% БЗМЖ 200г,4281766,шт,1.0,4.88,1775,,200 г,200.0,4.0,14.0,23.0,233.0,7.0
Пломбир Коровка из Кореновки ванильный 15% БЗМЖ 80г,4370936,шт,1.0,4.89,2084,69.99,80 г,80.0,3.4,15.3,21.8,240.0,7.0
Сорбет Верховье манговый с ароматом ванили 70г,4289011,шт,1.0,4.91,4291,,70 г,70.0,1.0,11.0,29.0,210.0,5.33
Пломбир Чистая Линия Московская лакомка 12% БЗМЖ 80г,3334700,шт,1.0,4.91,4565,186.99,80 г,80.0,3.5,23.5,20.9,309.0,6.67
Мороженое Чистая Линия пломбир без сахарозы с ароматом ванили в вафельном стаканчике 12% БЗМЖ 80г,4347653,шт,1.0,4.9,4006,164.99,80 г,80.0,3.8,11.5,23.1,211.0,7.33
Пломбир Свитлогорье с ароматом ванили и шоколадный в вафельном стаканчике 15% БЗМЖ 105г,4200606,шт,1.0,4.91,4679,,105 г,105.0,3.9,14.4,25.2,246.0,8.0
Мороженое Чистая линия пломбир с фисташковой пастой в вафельном рожке 12% БЗМЖ 110г,4315657,шт,1.0,4.86,3567,209.99,110 г,110.0,4.9,10.7,34.5,250.0,6.33
Эскимо Магнат фисташка-малина 8% БЗМЖ 70г,4208863,шт,1.0,4.88,2342,,70 мл,70.0,4.0,19.0,34.3,323.0,5.0
Мороженое Айсберри Филевский пломбир Соленая карамель с вареным сгущенным молоком 15% БЗМЖ 250г,4371711,шт,1.0,4.82,516,229.99,250 г,250.0,3.0,15.0,20.0,230.0,7.0
"Мороженое Maxiduo Страчателла с какаосодержащим соусом, кусочками шоколадного печенья и темного шоколада 6.5% БЗМЖ 282г",4359127,шт,1.0,4.83,259,399.99,282 г,282.0,3.6,9.3,32.9,230.0,6.33
Мороженое Коровка из Кореновки пломбир с вареной сгущенкой в вафельном рожке 15% БЗМЖ 120г,4345522,шт,1.0,4.88,3258,,120 г,120.0,4.5,17.0,42.0,340.0,8.0
Щербет Творожко-Морожко вареная сгущенка 12% БЗМЖ 70г,4352744,шт,1.0,4.75,1190,,80 г,80.0,5.5,21.9,28.3,331.9,4.0
"Мороженое Свитлогорье эскимо пломбир с ароматом ванили, с наполнителем черника с кусочками ягод в молочной глазури со вкусом йогурта 12% БЗМЖ 80г",4376288,шт,1.0,4.91,236,119.99,80 г,80.0,3.2,23.2,26.3,327.0,5.0
Мороженое Love is эскимо пломбир с банановым вкусом в клубничной глазури 12% БЗМЖ 65г,4348251,шт,1.0,4.86,818,,65 г,65.0,3.5,23.0,24.0,320.0,6.67
Пломбир Чистая Линия Ленинградское ванильный в шоколадной глазури 12% БЗМЖ 80г,3953742,шт,1.0,4.87,1470,,80 г,80.0,3.0,22.0,23.0,302.0,5.33
Пломбир Чистая линия Семейное ванильное 12% БЗМЖ 450г,3334702,шт,1.0,4.89,1079,,450 г,450.0,3.1,12.0,20.0,200.0,6.67
Мороженое Коровка из Кореновки Кубанская лакомка в черносмородиновой глазури 15% БЗМЖ 90г,4342118,шт,1.0,4.87,1606,,90 г,90.0,2.5,10.0,29.0,220.0,7.0
Мороженое Binggrae Samanko Рыбка с шоколадным сиропом в вафле СЗМЖ 91г,4318802,шт,1.0,4.73,538,,150 мл,150.0,3.0,8.0,31.0,210.0,5.33
Мороженое Коровка из Кореновки Пломбир двухслойный ванильный с манго и маракуйей 15.0% БЗМЖ 200г,4382508,шт,1.0,4.94,33,229.99,200 г,200.0,2.5,10.0,15.0,160.0,6.33
Пломбир Лева из Могилева шоколадный с горьким шоколадом на бисквитах с какао 12% БЗМЖ 80г,4371265,шт,1.0,4.78,205,119.99,80 г,80.0,4.7,12.3,35.8,272.7,5.67
Десерт Brand Ice фруктовый манго 380г,4280318,шт,1.0,4.65,369,,380 г,380.0,0.0,0.0,31.0,120.0,5.0
Мороженое Свитлогорье Мелодичная Вишня 15% БЗМЖ 300г,4346109,шт,1.0,4.81,43,359.99,300 г,300.0,2.9,12.5,27.2,233.0,7.0
Пломбир Чистая линия Протеиновое без сахарозы с ароматом ванили в вафельном стаканчике 12% БЗМЖ 80г,4366601,шт,1.0,4.76,70,,80 г,80.0,6.9,11.5,22.4,226.0,6.67
Круассаны 7 Days Мини с кремом Какао 265г,4332026,шт,1.0,4.94,15829,,265 г,265.0,6.0,26.0,46.0,448.0,4.67
Круассаны 7Days мини Кокосовый Десерт с кремом со вкусом кокоса 265г,4370840,шт,1.0,4.86,4508,,265 г,265.0,6.0,27.0,45.0,455.0,3.0
Рулет бисквитный Красная Цена клубничный 200г,3207531,шт,1.0,4.91,19201,40.99,200 г,200.0,4.0,16.0,55.0,360.0,6.67
Рулет Шарлиз бисквитный с кремом вареная сгущенка 200г,4371112,шт,1.0,4.88,2702,69.99,200 г,200.0,4.0,17.0,63.0,420.0,5.67
Круассаны 7 Days мини c кремом Ваниль 265г,4332029,шт,1.0,4.92,6579,,265 г,265.0,6.0,26.0,46.0,448.0,6.0
Круассан 7 Days с кремом какао 65г,86940,шт,1.0,4.93,8417,,65 г,65.0,7.0,28.0,42.0,452.0,5.33
Кремобон Сдобная Особа Классический 380г,4102507,шт,1.0,4.9,3415,274.99,380 г,380.0,5.0,18.0,52.0,390.0,5.33
Круассаны 7 Days Мини c кремом Вареная сгущенка 265г,4332022,шт,1.0,4.91,4358,,265 г,265.0,7.0,26.0,47.0,454.0,7.0
Круассаны 7 Days Мини c начинкой Клубника 265г,4332023,шт,1.0,4.88,3487,,265 г,265.0,6.0,16.0,54.0,388.0,6.0
Рулет Сдобная Особа с маковой начинкой 400г,26037,шт,1.0,4.9,4360,289.99,400 г,400.0,7.5,18.0,50.0,390.0,6.0
Пирожное Milka с шоколадной начинкой и кусочками молочного шоколада бисквитное 175г,4346485,шт,1.0,4.92,2001,,175 г,175.0,5.2,20.0,55.0,427.0,3.67
Набор пирожных Медвежонок Барни бисквитных с игрушкой 120г,4369811,шт,1.0,4.95,743,,120 г,120.0,5.9,15.0,59.0,396.0,6.33
Зефир Шарлиз бело-розовый 180г,4101229,шт,1.0,4.9,10378,99.99,180 г,180.0,1.0,0.1,80.0,330.0,5.33
Жевательный мармелад Mixbar фруктово-ягодный в ассортименте 70г,3978871,шт,1.0,4.91,11410,43.99,70 г,70.0,5.5,0.2,73.0,320.0,6.0
Мармелад Fruittella Медвежата жевательный 70г,2108128,шт,1.0,4.93,9817,87.99,70 г,70.0,6.0,0.1,73.0,320.0,5.67
Зефир Красная Цена ванильный 180г,3466802,шт,1.0,4.91,12741,59.99,180 г,180.0,1.0,0.0,81.0,310.0,7.0
Мармелад Mix Bar жевательный со вкусом колы 70г,3980249,шт,1.0,4.88,10867,43.99,70 г,70.0,5.5,0.0,72.0,310.0,6.0
Пастила Шарлиз Белевская классическая без добавления сахара 100г,4049946,шт,1.0,4.91,5258,,100 г,100.0,4.0,0.0,65.0,276.0,8.0
Маршмеллоу Шарлиз мини 150г,4266203,шт,1.0,4.91,8119,109.99,150 г,150.0,3.5,0.1,79.0,330.0,6.0
Маршмеллоу Mixbar с ароматом клубники 100г,4266204,шт,1.0,4.93,10992,,100 г,100.0,3.5,0.1,79.0,330.0,4.0
Зефир Шарлиз глазированный ваниль 240г,3406629,шт,1.0,4.9,7110,175.99,240 г,240.0,1.1,7.1,75.8,370.0,5.0
Мармелад Fruit-tella Змеи XXL жевательный 70г,2108134,шт,1.0,4.93,7917,87.99,70 г,70.0,5.0,0.2,76.0,330.0,4.67
Мармелад Шарлиз Французский сад желейный 300г,4255500,шт,1.0,4.93,6478,,300 г,300.0,0.0,0.0,80.0,320.0,6.0
Мармелад Бон Пари Duo Стильная Капибара со вкусом тропических фруктов жевательный 65г,4368690,шт,1.0,4.89,2759,,65 г,65.0,6.8,0.15,74.0,330.0,4.67
Пастила Шармэль Ваниль 221г,7662,шт,1.0,4.92,4011,,221 г,221.0,0.3,0.0,79.5,325.0,7.33
Мармелад Fruittella Крутой микс жевательный 150г,3694097,шт,1.0,4.93,7093,137.99,150 г,150.0,6.0,0.1,73.0,320.0,3.67
Мармелад Chupa Chups Страйпсы cо вкусом клубники 120г,4208928,шт,1.0,4.93,7838,184.99,120 г,120.0,2.0,2.0,79.0,350.0,4.0
Зефир Шармэль Ваниль 255г,9919,шт,1.0,4.9,2778,197.99,255 г,255.0,1.0,0.0,78.6,324.0,5.0
Зефир Шарлиз Белёвский Антоновка ручной работы 250г,4152129,шт,1.0,4.88,4732,229.99,250 г,250.0,1.0,0.0,79.0,320.0,6.5
Мармелад MixBar Злючки Змеючки Кислый вкус жевательный 140г,4122147,шт,1.0,4.89,7107,,140 г,140.0,8.0,0.0,70.0,310.0,5.67
Жевательный мармелад Chupa Chups Роллсы с Апельсиново-лимонным вкусом кислые 150г,4121693,шт,1.0,4.92,7121,184.99,150 г,150.0,0.4,0.5,86.0,360.0,4.67
Мармелад Mixbar Веселые мишки жевательный 140г,4082523,шт,1.0,4.89,8226,,140 г,140.0,8.0,0.0,70.0,310.0,4.33
Мармелад Бон Пари Кислые червячки жевательный 75г,43332,шт,1.0,4.92,5496,81.99,75 г,75.0,4.5,0.01,79.0,341.0,4.0
Мармелад Chupa Chups Фансы с фруктовым вкусом 150г,4122124,шт,1.0,4.92,6617,175.99,150 г,150.0,0.1,0.8,83.0,340.0,3.67
Зефир Шармэль Классический в шоколаде 250г,10795,шт,1.0,4.93,3894,,250 г,250.0,2.5,10.0,65.6,368.0,5.33
Мармелад Шарлиз желейный со вкусом абрикоса 300г,3139443,шт,1.0,4.89,4306,109.99,300 г,300.0,0.0,0.0,83.0,330.0,4.33
Зефир Коломенский яблочный 250г,4274721,шт,1.0,4.85,2692,,250 г,250.0,1.5,0.0,80.0,330.0,5.67
Мармелад Шарлиз желейный глазированный 250г,3908962,шт,1.0,4.9,4214,,250 г,250.0,1.0,7.0,76.0,370.0,4.0
Пастила Вкус & Польза Яблоко и малина фруктовая 27г,4376028,шт,1.0,4.9,649,,27 г,27.0,1.0,1.5,78.0,350.0,7.67
Пастила Шарлиз Белевская классическая 200г,4152130,шт,1.0,4.91,3863,239.99,200 г,200.0,1.0,0.0,74.0,296.0,7.67
Пастила Красная Цена со вкусом ванили 180г,3955802,шт,1.0,4.87,4100,46.99,180 г,180.0,0.5,0.0,84.0,340.0,5.0
Зефир Шарлиз с ароматом ванили,3936545,кг,0.2,4.89,5509,549.99,Цена за 1 кг,200.0,1.1,7.1,75.8,370.0,5.33
Мармелад Бон Пари Дуо Роял Корги со вкусом тропических коктейлей жевательный 100г,4314146,шт,1.0,4.88,3950,,100 г,100.0,6.8,0.15,74.0,330.0,4.33
Мармелад Fruit-tella Yo!rms жевательный со вкусом йогурта и фруктов клубники персика и лимона 138г,3981396,шт,1.0,4.91,4238,,138 г,138.0,6.5,0.2,80.0,340.0,6.33
Мармелад Fruit-tella Звери Mix жевательный апельсин-яблоко-лимон-клубника-малина 150г,3485963,шт,1.0,4.91,3613,137.99,150 г,150.0,6.0,0.1,74.0,320.0,6.0
Мармелад Бон Пари Кислые змейки жевательный фигурный фрукты 120г,3928270,шт,1.0,4.9,2962,,120 г,120.0,4.5,0.0,79.0,341.0,5.67
Пастила Шарлиз со вкусом клюквы 220 г,3418182,шт,1.0,4.88,1276,107.99,220 г,220.0,0.5,0.0,84.0,340.0,5.67
Набор кондитерских изделий Fruit-Tella Письмо Волшебнику 199г,4363403,шт,1.0,4.87,1183,,199 г,199.0,1.5,0.2,92.0,390.0,5.67
Мармелад Бон Пари Машины жевательный фрукты 75г,2127571,шт,1.0,4.92,2485,81.99,75 г,75.0,5.3,0.11,76.0,330.0,4.67
Маршмеллоу Reeel Карамель на палочке 15г,4357633,шт,1.0,4.82,960,49.99,15 г,15.0,3.2,0.1,79.0,330.0,4.33
"Мармелад Sweet Box Апельсин, яблоко, клубника, персик, манго в ассортименте 10г",4113957,шт,1.0,4.89,4524,,10 г,10.0,6.0,0.0,77.0,332.0,4.67
"Мармелад Sweet Box Апельсин, яблоко, клубника, персик, манго в ассортименте 10г",4113958,шт,1.0,4.91,4371,,10 г,10.0,6.0,0.0,77.0,332.0,4.67
Лента фруктовая Reeel Малина 15г,4347919,шт,1.0,4.78,235,,15 г,15.0,0.6,0.0,78.0,315.0,7.0
"Мармелад Reeel Яблоко, вишня, банан фруктовый с витамином Е, цинком и селеном 15г",4347916,шт,1.0,4.83,101,,15 г,15.0,0.9,1.6,74.1,332.0,6.67
Лента фруктовая Reeel Манго 15г,4347918,шт,1.0,4.75,229,,15 г,15.0,0.8,0.0,78.0,315.0,6.0
Вафли Яшкино глазированные с орешками 200г,2126636,шт,1.0,4.93,19769,83.99,200 г,200.0,6.0,32.0,56.0,540.0,5.67
