Product Name,PLU,UOM,Step,Rating,Rates Count,Price,Property Clarification,Weight,Nutrients Protein,Nutrients Fat,Nutrients Carbs,Nutrients Calories,Score
Кофе Латте 330мл,78034281,шт,1.0,4.73,2087,99.99,330 мл,330.0,6.84,6.85,9.65,127.61,7.0
Кофе Большой Капучино 270мл,78034282,шт,1.0,4.69,1191,99.99,270 мл,270.0,5.25,5.26,7.17,97.02,6.33
Кофе Американо Гранде 320мл,78034285,шт,1.0,4.69,518,79.99,320 мл,320.0,0.47,0.48,0.11,6.64,5.0
Кофе Флэт Уайт 200мл,78034280,шт,1.0,4.56,339,99.99,200 мл,200.0,4.81,4.83,6.49,88.67,8.0
Кофе Большой Американо 230мл,78034284,шт,1.0,4.8,198,49.99,230 мл,230.0,0.41,0.42,0.09,5.78,5.67
Кофе Двойной Эспрессо 100мл,78034283,шт,1.0,4.64,131,79.99,100 мл,100.0,0.5,0.51,0.12,7.07,7.0
Кофе с молоком 260мл,78034286,шт,1.0,4.73,100,99.99,260 мл,260.0,5.32,5.33,7.38,98.77,6.33
Каша Рисовая на молоке Пятерочка Кафе 200г,4216695,шт,1.0,4.92,9561,94.99,200 г,200.0,2.5,3.0,15.0,95.0,7.0
Каша пшенная на молоке Пятерочка Кафе 200г,4260436,шт,1.0,4.89,4870,89.99,200 г,200.0,3.0,3.0,13.0,95.0,7.0
Сырники жареные Пятерочка Кафе 220г,4213985,шт,1.0,4.79,4173,159.99,220 г,220.0,11.6,11.1,24.1,207.0,5.33
Сырники с малиновой начинкой Рестория Шеф 140г,4235408,шт,1.0,4.86,2685,149.99,140 г,140.0,9.7,15.5,25.6,280.7,7.33
Оладьи По-домашнему Пятерочка Кафе 160г,4191428,шт,1.0,4.78,3938,99.99,160 г,160.0,9.0,11.5,46.6,300.0,7.33
Запеканка Вкус & Польза творожная с черной смородиной 200г,4362366,шт,1.0,4.73,1531,169.99,200 г,200.0,11.4,5.0,21.6,177.0,8.0
Запеканка Вкус & Польза творожная с яблоком и корицей 200г,4362369,шт,1.0,4.83,1276,169.99,200 г,200.0,12.0,5.0,23.5,187.0,8.0
Сырники Вкус & Польза творожные 340г,4362582,шт,1.0,4.76,1045,,340 г,340.0,10.0,6.0,21.0,180.0,7.33
Блинчики без начинки Пятерочка Кафе 200г,4355855,шт,1.0,4.8,2851,99.99,200 г,200.0,5.8,8.8,22.0,190.0,7.0
Каша Гурьевская на топленом молоке с изюмом Пятерочка Кафе 200г,4260437,шт,1.0,4.84,2136,99.99,200 г,200.0,2.5,4.0,13.0,100.0,7.0
Блинчики с ветчиной и сыром Пятерочка Кафе 160г,4365538,шт,1.0,4.79,682,109.99,160 г,160.0,11.0,8.0,26.0,220.0,6.33
Блинчики с мясом Пятерочка Кафе 160г,4365536,шт,1.0,4.82,381,139.99,160 г,160.0,14.0,8.0,26.0,230.0,6.67
Сэндвич куриный с беконом Пятерочка Кафе 185г,4344431,шт,1.0,4.84,5344,179.99,185 г,185.0,8.1,16.2,21.6,264.0,6.0
Онигири с крабовыми палочками и соусом Спайси Пятерочка Кафе 110г,4342266,шт,1.0,4.8,5256,109.99,110 г,110.0,2.7,6.8,32.0,200.0,5.0
Онигири с тунцом и соусом Спайси Пятерочка Кафе 110г,4342264,шт,1.0,4.77,4849,119.99,110 г,110.0,3.9,6.2,30.9,195.0,7.67
Онигири с кальмаром и соусом Том Ям Пятерочка Кафе 110г,4342268,шт,1.0,4.7,4642,119.99,110 г,110.0,5.0,6.0,27.6,184.4,5.0
Шаурма с курицей Пятерочка Кафе 200г,4279168,шт,1.0,4.68,5449,169.99,200 г,200.0,10.6,10.3,30.9,259.0,6.67
Сэндвич-ролл с горбушей Пятерочка Кафе 200г,4364577,шт,1.0,4.5,572,164.99,200 г,200.0,9.8,13.0,22.9,248.0,7.0
Чизбургер Пятерочка Кафе 130г,4355138,шт,1.0,4.69,2525,129.99,130 г,130.0,8.1,11.8,20.3,220.0,4.0
Сэндвич-ролл с курицей том ям Пятерочка Кафе 195г,4376856,шт,1.0,4.8,277,149.99,195 г,195.0,9.3,14.8,25.8,273.6,5.33
Гамбургер Пятерочка Кафе 120г,4355139,шт,1.0,4.66,1676,99.99,120 г,120.0,7.2,10.1,21.8,207.4,4.67
Сэндвич-ролл с бужениной Пятерочка Кафе 175г,4376854,шт,1.0,4.71,291,149.99,175 г,175.0,9.0,13.9,24.3,259.0,6.0
Сэндвич-ролл с индейкой Пятерочка Кафе 230г,4376855,шт,1.0,4.73,183,199.99,230 г,230.0,11.9,10.4,25.9,244.8,7.0
Чикен-ролл Пятерочка Кафе 200г,4364575,шт,1.0,4.78,403,159.99,200 г,200.0,10.2,13.9,26.4,272.0,6.33
Онигири Филадельфия с семгой и творожным сыром Пятерочка Кафе 110г,4353020,шт,1.0,4.72,5081,139.99,110 г,110.0,3.6,6.4,30.2,192.8,6.33
"Онигири с угрем, курицей и шампиньонами Пятерочка Кафе 110г",4369260,шт,1.0,4.6,3202,139.99,110 г,110.0,4.1,5.1,28.6,176.7,7.67
Ролл Симфония с креветкой темпура Пятерочка Кафе 180г,4370998,шт,1.0,4.77,928,249.99,180 г,180.0,5.5,10.5,23.7,211.3,5.67
Ролл Симфония с курицей и соусом цезарь Пятерочка Кафе 180г,4371000,шт,1.0,4.78,420,199.99,180 г,180.0,6.8,5.8,30.1,199.8,6.33
Лазанья Болоньезе с сыром в соусе Бешамель Мираторг 350г,4261976,шт,1.0,4.73,4732,179.99,350 г,350.0,7.5,6.4,17.1,156.5,8.0
Паста с ветчиной и грибами Пятерочка Кафе 250г,4315309,шт,1.0,4.88,5414,184.99,250 г,250.0,5.6,8.1,14.9,155.0,7.0
Плов с курицей Пятерочка Кафе 250г,4191429,шт,1.0,4.88,6818,149.99,250 г,250.0,7.1,13.5,17.9,200.0,6.0
Котлета из трески с рисом и овощами Рестория Шеф 250г,4263421,шт,1.0,4.68,3681,179.99,250 г,250.0,5.5,5.0,18.0,140.0,8.0
Голень куриная гриль Пятерочка Кафе,4295038,кг,0.4,4.89,8650,74.99,Цена за 100 г,400.0,15.0,34.0,2.5,370.0,7.0
Голубцы ленивые в томатно-сметанном соусе Пятерочка Кафе 250г,4299030,шт,1.0,4.78,1976,164.99,250 г,250.0,9.2,9.4,11.2,166.0,8.0
Крылышки куриные гриль Пятерочка Кафе,4295037,кг,0.4,4.87,5482,77.99,Цена за 100 г,400.0,13.0,34.0,2.5,370.0,7.0
Паста Карбонара Пятерочка Кафе 250г,4364665,шт,1.0,4.81,1023,159.99,250 г,250.0,7.0,10.3,18.3,194.0,8.33
Манты с мясом Пятерочка Кафе 240г,4362983,шт,1.0,4.75,4012,174.99,240 г,240.0,6.2,18.1,26.2,292.5,7.0
Капуста тушеная с сосисками Пятерочка Кафе 250г,4372194,шт,1.0,4.76,1954,159.99,250 г,250.0,2.9,5.9,8.8,99.9,6.67
Паста Болоньезе Пятерочка Кафе 250г,4364664,шт,1.0,4.88,784,159.99,250 г,250.0,4.7,5.0,20.5,146.0,8.0
Кутабы с сыром и зеленью Пятерочка Кафе 150г,4353542,шт,1.0,4.74,2641,179.99,150 г,150.0,7.2,8.6,32.7,237.0,8.0
Борщ украинский с курицей Пятерочка Кафе 250г,4292797,шт,1.0,4.88,9690,119.99,250 г,250.0,2.5,2.0,4.8,50.0,6.67
Суп куриный с домашней лапшой Пятерочка Кафе 250г,4292794,шт,1.0,4.84,6162,109.99,250 г,250.0,4.0,5.5,6.5,90.0,6.0
Суп Солянка сборная мясная по-домашнему Пятерочка Кафе 250г,4292792,шт,1.0,4.79,4976,146.99,250 г,250.0,4.0,3.9,4.6,70.0,7.67
Суп-пюре грибной Пятерочка Кафе 250г,4292789,шт,1.0,4.84,4760,159.99,250 г,250.0,2.7,5.7,10.0,100.0,6.33
Суп гороховый с копченостями Пятерочка Кафе 250г,4292795,шт,1.0,4.82,4532,124.99,250 г,250.0,3.5,5.0,8.0,90.0,5.67
Суп Харчо Пятерочка Кафе 250г,4292791,шт,1.0,4.82,4636,136.99,250 г,250.0,3.2,1.1,9.9,60.0,6.33
Салат Оливье Пятерочка Кафе 200г,4316740,шт,1.0,4.84,6228,119.99,200 г,200.0,5.4,10.9,6.5,146.0,3.67
Салат сельдь под шубой Пятерочка Кафе 250г,4322017,шт,1.0,4.82,6174,159.99,250 г,250.0,6.2,14.5,8.0,188.0,5.0
Салат с кальмаром Пятерочка Кафе 200г,4287278,шт,1.0,4.85,4360,174.99,200 г,200.0,4.8,16.6,9.3,206.0,6.67
Салат Крабовый Пятерочка Кафе 200г,4322016,шт,1.0,4.84,4547,129.99,200 г,200.0,4.3,19.3,14.2,245.0,6.33
Салат Фаворит с бужениной и шампиньонами Пятерочка Кафе 200г,4345530,шт,1.0,4.76,4448,169.99,200 г,200.0,7.7,18.6,3.9,210.0,6.67
Салат Гнездо глухаря Пятерочка Кафе 200г,4299031,шт,1.0,4.74,4472,184.99,200 г,200.0,14.7,17.6,6.9,230.0,7.0
Салат Цезарь с курицей Пятерочка Кафе 180г,4353672,шт,1.0,4.66,3358,189.99,180 г,180.0,9.4,17.2,6.8,220.0,6.67
Салат оливье Пятерочка Кафе 500г,4316741,шт,1.0,4.82,4964,249.99,500 г,500.0,5.4,10.9,6.5,146.0,4.67
Салат Винегрет Пятерочка Кафе 180г,4343382,шт,1.0,4.58,4531,94.99,180 г,180.0,2.1,4.5,9.6,87.2,7.0
Салат столичный Рестория Шеф 200г,4191361,шт,1.0,4.69,4090,149.99,200 г,200.0,9.2,21.8,6.1,260.0,5.0
Салат Деревенский с курицей и фасолью Пятерочка Кафе 200г,4315310,шт,1.0,4.8,3401,149.99,200 г,200.0,6.9,14.0,10.6,196.0,7.0
Салат печеночный с картофелем и грибами Пятерочка Кафе 200г,4299028,шт,1.0,4.79,4089,159.99,200 г,200.0,5.3,20.2,19.0,279.0,5.33
Салат Коул Слоу капустный с апельсиновым соком Пятерочка Кафе 200г,4211040,шт,1.0,4.88,4385,109.99,200 г,200.0,1.5,17.8,10.1,207.0,4.33
Салат Мимоза Пятерочка Кафе 200г,4335076,шт,1.0,4.79,2772,154.99,200 г,200.0,7.3,16.0,6.2,198.0,4.0
Салат сельдь под шубой Пятерочка Кафе 500г,4317626,шт,1.0,4.83,4246,284.99,500 г,500.0,6.2,14.5,8.0,188.0,5.0
Салат Весенний Пятерочка Кафе 160г,4349646,шт,1.0,4.88,4527,114.99,160 г,160.0,1.2,5.4,6.1,77.8,7.0
Салат Фермерский с салями Пятерочка Кафе 200г,4287271,шт,1.0,4.77,3876,124.99,200 г,200.0,3.9,18.6,9.0,219.0,4.67
Салат Грин Микс с курицей и шампиньонами Пятерочка Кафе 150г,4353670,шт,1.0,4.68,1571,179.99,150 г,150.0,8.4,7.1,2.7,108.0,8.0
Салат Кобб Пятерочка Кафе 170г,4357183,шт,1.0,4.63,974,169.99,170 г,170.0,4.3,15.7,9.2,195.0,7.0
Салат Морковь по-корейски Рестория Шеф 400г,4125694,шт,1.0,4.92,21054,89.99,400 г,400.0,4.2,4.0,10.6,95.0,6.0
Салат морская капуста с крабовым мясом Fish House 400г,3950270,шт,1.0,4.9,9089,119.99,400 г,400.0,2.0,26.0,3.0,254.0,6.67
Салат из морской капусты с кальмаром в майонезе Fish House 250г,4108226,шт,1.0,4.89,7591,99.99,250 г,250.0,3.5,18.0,2.5,190.0,7.0
Салат дальневосточный из морской капусты Fish House 250г,3398711,шт,1.0,4.88,6270,59.99,250 г,250.0,0.5,5.0,1.5,55.0,6.67
Салат Витаминный из морской капусты Fish House 430г,3950268,шт,1.0,4.88,5631,99.99,430 г,430.0,0.5,4.5,4.0,52.0,5.33
Салат Чука Fish House 180г,4104710,шт,1.0,4.86,4698,139.99,180 г,180.0,1.1,10.0,7.1,120.0,5.33
Салат морковь со спаржей по-корейски Рестория Шеф 400г,4147973,шт,1.0,4.86,4980,119.99,400 г,400.0,5.0,6.5,7.5,110.0,8.0
Салат Чука в ореховом соусе Fish House 200г,4104709,шт,1.0,4.84,3494,159.99,200 г,200.0,1.8,9.5,8.5,130.0,5.0
Салат Фунчоза По-Корейски Пятерочка Кафе 200г,4343383,шт,1.0,4.87,3625,99.99,200 г,200.0,0.5,3.2,25.4,132.0,4.67
Салат Капуста по-корейски Рестория Шеф 200г,4261467,шт,1.0,4.83,2650,109.99,200 г,200.0,1.6,6.0,4.4,77.0,3.0
Салат Баклажаны по-корейски Рестория Шеф 200г,4261466,шт,1.0,4.78,2398,119.99,200 г,200.0,0.7,6.0,3.2,69.6,6.33
Хумус Классический Рестория Шеф 200г,4116551,шт,1.0,4.77,2654,124.99,200 г,200.0,6.0,19.0,11.0,236.0,6.67
Хумус с кедровыми орешками Рестория Шеф 200г,4116552,шт,1.0,4.74,3260,142.99,200 г,200.0,6.0,19.0,11.0,236.0,6.67
Сэндвич-ролл Цезарь Пятерочка Кафе 200г,4364574,шт,1.0,4.78,893,149.99,200 г,200.0,7.8,16.4,23.9,274.0,8.0
Паштет из шампиньонов Грибная Кухня 230г,3648674,шт,1.0,4.82,3031,159.99,230 г,230.0,7.0,19.0,0.8,200.0,4.67
Хумус с острым соусом Рестория Шеф 200г,4116553,шт,1.0,4.75,1096,134.99,200 г,200.0,6.0,18.0,11.0,225.0,7.0
Морс облепиховый Пятерочка Кафе 0.5л,4168789,шт,1.0,4.9,2885,99.99,500 мл,500.0,0.0,0.0,13.0,52.0,6.33
Морс клюквенный Пятерочка Кафе 0.5л,4168788,шт,1.0,4.88,3599,99.99,500 мл,500.0,0.0,0.0,12.0,48.0,7.0
Лимонад Лимон-имбирь Пятерочка Кафе 500мл,4250372,шт,1.0,4.87,3013,94.99,500 мл,500.0,0.0,0.0,11.0,45.0,6.0
Смузи банан-манго Пятерочка Кафе 0.3л,4326274,шт,1.0,4.84,772,119.99,300 мл,300.0,0.0,0.0,10.0,40.0,6.67
Чебупицца Пепперони Горячая Штучка 250г,3416332,шт,1.0,4.91,22809,,250 г,250.0,9.0,12.0,32.0,270.0,6.0
Блины с творогом С Пылу с Жару 360г,3273892,шт,1.0,4.91,7475,,360 г,360.0,5.0,3.0,22.0,140.0,6.67
Блины с мясом С Пылу с Жару 360г,3273891,шт,1.0,4.89,9142,,360 г,360.0,6.5,3.5,19.0,130.0,6.33
Чебупицца Курочка по-итальянски Горячая Штучка 250г,3421780,шт,1.0,4.91,17503,212.99,250 г,250.0,8.0,13.0,29.0,270.0,5.67
Хотстеры Горячая Штучка 250г,3435321,шт,1.0,4.92,14601,,250 г,250.0,8.0,12.0,17.0,210.0,4.33
Чебупели Сочные с мясом Горячая Штучка 250г,3373886,шт,1.0,4.92,15544,,250 г,250.0,7.0,11.0,28.0,240.0,4.67
Чебупели с ветчиной и сыром Горячая штучка 250г,3395673,шт,1.0,4.89,13573,208.99,250 г,250.0,7.0,15.0,40.0,320.0,6.33
Блины с мясом Останкино 420г,2141551,шт,1.0,4.9,7833,,420 г,420.0,8.0,11.0,33.0,270.0,6.0
Блины с вишней С Пылу с Жару 360г,3269961,шт,1.0,4.87,5043,,360 г,360.0,3.0,3.0,25.0,140.0,8.0
Блины с ветчиной и сыром С Пылу с Жару 360г,3426375,шт,1.0,4.85,5583,203.99,360 г,360.0,5.0,7.0,17.0,150.0,5.0
Блины с куриным мясом Останкино 420г,2170437,шт,1.0,4.89,6008,169.99,420 г,420.0,8.0,11.0,33.0,270.0,6.0
Блинчики для фаршировки С пылу с жару 310г,3604375,шт,1.0,4.9,4559,,310 г,310.0,4.0,4.0,22.0,140.0,6.67
Чебурек Твистер's band Чебурито с мясом замороженный 85г,4009387,шт,1.0,4.89,17776,,85 г,85.0,9.0,14.0,31.5,288.0,6.0
Круггетсы с сырным соусом Горячая Штучка 250г,3477910,шт,1.0,4.87,6966,208.99,250 г,250.0,8.5,16.0,20.0,260.0,4.0
Лазанья мясная замороженная Золотой Петушок 370г,2157530,шт,1.0,4.83,5644,257.99,370 г,370.0,7.6,4.1,18.7,142.1,5.0
Чебурек Богатырь с мясом Жаренки 180г,3680892,шт,1.0,4.89,7335,97.99,180 г,180.0,9.3,14.5,31.7,294.0,4.67
Оладьи оладушки С Пылу С Жару 280г,3371860,шт,1.0,4.86,1725,,280 г,280.0,6.0,4.0,40.0,200.0,6.67
Пончик с начинкой со вкусом клубники глазированный Don Donut 65г,4336618,шт,1.0,4.85,3256,54.99,65 г,65.0,5.9,18.7,39.0,329.0,3.0
Солянка По-домашнему замороженая Главсуп 250г,3236284,шт,1.0,4.9,4265,,250 г,250.0,1.3,2.5,4.0,44.0,8.0
Блинчики шоколадные с белым шоколадом замороженные С пылу с жару 220г,4278081,шт,1.0,4.8,1429,229.99,220 г,220.0,8.0,15.0,33.0,300.0,5.67
Блины с печенью замороженные Останкино 420г,2141553,шт,1.0,4.87,1694,129.99,420 г,420.0,8.0,10.0,33.0,260.0,6.67
Пельмени Супермени со сливочным маслом Горячая Штучка 200г,4042247,шт,1.0,4.86,3202,,200 г,200.0,11.0,6.0,20.0,180.0,4.0
Крылышки Хрустящие острые к пиву Горячая Штучка 300г,3446271,шт,1.0,4.8,3192,339.99,300 г,300.0,12.0,13.0,27.0,270.0,5.0
Сырники Элика По-Домашнему замороженные 320г,4310367,шт,1.0,4.66,357,219.99,320 г,320.0,15.5,7.0,19.5,230.0,6.0
Оладьи-сэндвичи с ореховой пастой замороженные С пылу с жару 60г,4351078,шт,1.0,4.69,841,,60 г,60.0,5.5,10.5,52.0,320.0,7.33
Плов с мясом цыпленка Российская корона 300г,3404868,шт,1.0,4.82,1298,239.99,300 г,300.0,7.8,4.6,19.0,148.6,6.67
Запеканка картофельная замороженная Разогрей-Ка 250г,4339081,шт,1.0,4.35,711,194.99,250 г,250.0,8.0,9.0,15.0,146.0,6.0
Азу из курицы с картофельным пюре замороженное СытоЕдов 300г,4306830,шт,1.0,4.81,803,,300 г,300.0,5.0,5.0,8.5,100.0,7.33
Лепешка замороженная ROTI 450г,4147575,шт,1.0,4.88,389,219.99,450 г,450.0,6.1,15.0,37.8,311.0,7.67
Паэлья Испанское блюдо 4 Сезона 600г,728,шт,1.0,4.86,1061,692.99,600 мл,600.0,8.0,3.0,17.0,130.0,5.33
Жюльен из курицы с грибами замороженный Российская Корона 250г,3621247,шт,1.0,4.66,611,,250 г,250.0,14.8,11.1,4.1,175.5,6.0
Котлеты куриные запеченные замороженные Главобед 340г,4337207,шт,1.0,4.77,323,299.99,340 г,340.0,13.7,7.2,12.5,170.0,7.67
Беляши Омские жареные замороженные Дарина 400г,4336477,шт,1.0,4.77,632,329.99,400 г,400.0,10.0,8.0,24.0,210.0,5.0
Лапша гречневая Тори Ясай Соба с цыпленком и овощами Perfetto 250г,4071297,шт,1.0,4.73,445,,250 г,250.0,8.2,6.9,16.1,159.3,7.0
Мини-чебуреки Чебурито с мясом Твистер 300г,4078158,шт,1.0,4.58,1586,,300 г,300.0,11.0,10.2,30.6,258.0,5.67
Блюдо готовое Фондю Эменталь замороженное 4 сезона 600г,3054891,шт,1.0,4.82,337,588.99,600 г,600.0,7.9,10.2,13.3,175.0,7.67
Каша рисовая с яблочно-апельсиновым соусом замороженная Фросток 320г,4340916,шт,1.0,4.64,28,149.99,320 г,320.0,1.5,2.5,11.0,70.0,7.0
Булочки Bibigo Бао со свининой замороженные 320г,4372071,шт,1.0,4.66,30,399.99,320 г,320.0,7.3,11.9,33.5,270.8,5.0
Спагетти Карбонара замороженные Фросток 210г,4340915,шт,1.0,4.71,107,299.99,210 г,210.0,9.5,9.5,21.0,200.0,6.67
Тесто для чебуреков 500г,3608912,шт,1.0,4.94,7861,99.99,500 г,500.0,9.0,1.0,52.0,250.0,8.0
Булочка с корицей замороженная п/ф 90г,4200588,шт,1.0,4.74,202,39.99,90 г,90.0,5.5,27.0,45.0,450.0,6.0
Тесто для пельменей охлажденное Тестов 360г,3443131,шт,1.0,4.91,3696,89.99,360 г,360.0,9.0,1.0,52.0,250.0,8.0
Багет Традиционный замороженный п/ф 260г,4112024,шт,1.0,4.49,68,39.99,260 г,260.0,8.5,1.0,60.0,280.0,4.67
Багет Ржаной чесночный замороженный п/ф 200г,4117904,шт,1.0,4.56,74,64.99,200 г,200.0,6.5,14.0,45.1,332.0,8.0
Улитка Греческая с курицей и картофелем замороженная п/ф 180г,3368459,шт,1.0,4.6,62,59.99,180 г,180.0,9.0,7.0,33.0,230.0,6.67
Улитка Греческая со шпинатом и сыром замороженная п/ф 180г,3368457,шт,1.0,4.66,47,59.99,180 г,180.0,8.0,9.0,34.0,250.0,7.0
Слойка Valentain дрожжевая с вишней п/ф 90г,3612462,шт,1.0,4.82,63,29.99,90 г,90.0,4.5,12.0,46.0,310.0,7.0
Улитка с ванильной начинкой и изюмом п/ф 100г,4233266,шт,1.0,4.67,45,45.99,100 г,100.0,4.0,18.0,37.0,320.0,6.0
Багет чесночный замороженный п/ф 175г,4117906,шт,1.0,4.82,64,64.99,175 г,175.0,6.7,11.0,45.0,305.8,7.0
Улитка Греческая с мясом замороженная п/ф 180г,3368456,шт,1.0,4.63,60,59.99,180 г,180.0,8.0,18.5,36.0,345.0,5.67
Слойка DeLavant с малиной п/ф 85г,4237846,шт,1.0,4.92,40,29.99,85 г,85.0,4.0,15.0,42.0,330.0,6.0
Розан со смородиной замороженный п/ф 130г,3658222,шт,1.0,4.86,32,39.99,130 г,130.0,3.3,12.5,40.8,289.0,4.0
Хлебушек заварной бездрожжевой замороженный п/ф 350г,3608756,шт,1.0,4.21,21,65.99,350 г,350.0,5.9,0.9,47.9,230.0,7.33
Чиабатта Рустик замороженная п/ф 300г,3645121,шт,1.0,4.85,39,59.99,300 г,300.0,7.82,0.83,42.17,207.0,5.0
Круассан Мириталь с миндалем п/ф 70г,4198978,шт,1.0,4.73,34,79.99,70 г,70.0,9.5,26.6,43.7,452.2,7.0
Пирожок с зеленым луком и яйцом п/ф 65г,4342779,шт,1.0,4.36,33,35.99,65 г,65.0,7.0,5.0,28.0,180.0,7.0
Пирог домашний с творожной начинкой п/ф 100г,4278636,шт,1.0,4.9,31,39.99,100 г,100.0,7.0,10.0,48.0,310.0,7.0
Слойка с сосиской замороженная п/ф 90г,3474487,шт,1.0,4.88,24,45.99,90 г,90.0,7.0,19.0,36.0,340.0,4.0
Слойка с ветчиной и сыром п/ф 90г,4262738,шт,1.0,4.6,21,39.99,90 г,90.0,9.0,21.5,30.0,350.0,4.0
Самса с курицей и овощами замороженная п/ф 122г,4220033,шт,1.0,4.52,28,45.99,122 г,122.0,6.4,9.7,31.2,237.7,6.67
Элеш с курицей замороженный п/ф 230г,3635486,шт,1.0,4.63,20,79.99,230 г,230.0,7.0,11.0,26.0,230.0,5.33
Хлеб с семечками замороженный п/ф 400г,3682002,шт,1.0,4.67,12,69.99,400 г,400.0,11.0,8.0,46.0,300.0,7.67
Сочень с творогом п/ф 110г,4118627,шт,1.0,4.91,11,49.99,110 г,110.0,8.0,18.3,46.1,381.0,6.67
Хлеб Пшеничный п/ф 400г,4163804,шт,1.0,4.33,12,59.99,400 г,400.0,7.5,3.0,48.0,250.0,8.0
Улитка с корицей 80г,78031990,шт,1.0,4.9,42551,39.99,80 г,80.0,5.6,26.8,45.4,445.0,5.0
Розан с начинкой Черная смородина 120г,78009909,шт,1.0,4.92,18587,39.99,120 г,120.0,3.3,12.49,40.8,289.0,5.67
Слойка с начинкой Вишня 81г,78007176,шт,1.0,4.88,18618,29.99,81 г,81.0,5.0,14.8,50.2,354.0,5.33
"Слойка с малиной, 75г",78032640,шт,1.0,4.88,13609,29.99,75 г,75.0,4.0,14.5,46.0,330.0,5.67
Пирог домашний с творожной начинкой 96г,78033558,шт,1.0,4.9,27394,39.99,96 г,96.0,7.0,10.0,48.0,310.0,6.67
Круассан с миндалем 68г,78031923,шт,1.0,4.88,18889,79.99,68 г,68.0,9.5,26.6,43.7,452.2,5.33
Пекан кленовый 70г,78010930,шт,1.0,4.91,15208,59.99,70 г,70.0,4.5,27.0,39.0,420.0,3.33
Улитка с ванильной начинкой и изюмом 90г,78032555,шт,1.0,4.9,21439,44.99,90 г,90.0,4.0,18.0,37.0,320.0,5.0
Сочень с творогом 91г,78030425,шт,1.0,4.89,15919,49.99,91 г,91.0,8.0,18.3,46.1,381.0,6.67
Плетенка с маком 204г,78035465,шт,1.0,4.76,2355,79.99,204 г,204.0,7.0,13.0,49.0,360.0,7.67
Улитка Греческая с курицей и картофелем 160г,3368421,шт,1.0,4.91,99062,59.99,160 г,160.0,8.7,6.7,32.6,226.0,6.67
Улитка Греческая с мясом 160г,3368414,шт,1.0,4.89,67883,59.99,160 г,160.0,9.3,7.7,31.6,233.0,5.67
Улитка Греческая со шпинатом и сыром 160г,3368417,шт,1.0,4.86,35217,59.99,160 г,160.0,7.6,9.2,33.6,248.0,5.33
Самса с курицей и овощами 100г,78032235,шт,1.0,4.87,30316,45.99,100 г,100.0,6.6,11.0,31.4,251.0,8.0
Слойка с ветчиной и сыром 80г,78033093,шт,1.0,4.86,19602,39.99,80 г,80.0,8.7,16.3,24.7,298.0,5.0
Слойка с сосиской 75г,78006242,шт,1.0,4.9,32888,45.99,75 г,75.0,7.2,19.3,36.0,351.0,4.0
Пирожок с яйцом и зеленым луком 65г,78034706,шт,1.0,4.82,11293,34.99,65 г,65.0,7.0,5.0,28.0,180.0,5.33
Пирожок с начинкой Капуста 75г,78011228,шт,1.0,4.89,17939,34.99,75 г,75.0,4.9,6.2,38.5,228.9,4.67
Элеш с курицей 220г,78005834,шт,1.0,4.81,29576,79.99,220 г,220.0,10.9,11.2,20.4,215.0,7.67
Хачапури 80г,78033187,шт,1.0,4.86,8567,44.99,80 г,80.0,5.5,24.0,32.0,360.0,5.0
Круассан классический 50г,78033013,шт,1.0,4.85,9512,25.99,50 г,50.0,7.0,17.0,42.0,350.0,8.0
Багет ржаной чесночный 180г,78030125,шт,1.0,4.93,57783,64.99,180 г,180.0,6.5,14.0,45.1,332.0,7.33
Багет традиционный 230г,78030107,шт,1.0,4.88,36893,39.99,230 г,230.0,8.0,13.0,34.0,280.0,5.0
